{
  "meta": {
    "schema_version": "1.0.0",
    "exporter_version": "1.0.0",
    "generated_at": "2026-05-06T13:32:47.493238+00:00",
    "evaluation_dir": "runs/final_validation_smoke_contract_full/evaluation",
    "robustness_dir": "runs/final_validation_smoke_contract_full/robustness",
    "secondary_dirs": [
      "runs/final_validation_smoke_contract_full/secondary_json_yaml",
      "runs/final_validation_smoke_contract_full/secondary_model_compare"
    ],
    "split": "validation",
    "artifacts": [
      {
        "id": "evaluation_summary",
        "path": "runs/final_validation_smoke_contract_full/evaluation/evaluation_summary.json",
        "exists": true,
        "kind": "json",
        "size_bytes": 2106,
        "row_count": 3
      },
      {
        "id": "comparison_table",
        "path": "runs/final_validation_smoke_contract_full/evaluation/comparison_table.csv",
        "exists": true,
        "kind": "csv",
        "size_bytes": 624,
        "row_count": 3
      },
      {
        "id": "document_scores",
        "path": "runs/final_validation_smoke_contract_full/evaluation/document_scores.json",
        "exists": true,
        "kind": "json",
        "size_bytes": 30333,
        "row_count": 3
      },
      {
        "id": "robustness_summary",
        "path": "runs/final_validation_smoke_contract_full/robustness/robustness_summary.json",
        "exists": true,
        "kind": "json",
        "size_bytes": 41614,
        "row_count": 4
      },
      {
        "id": "label_preserving_degradation",
        "path": "runs/final_validation_smoke_contract_full/robustness/label_preserving_degradation.csv",
        "exists": true,
        "kind": "csv",
        "size_bytes": 4458,
        "row_count": 21
      },
      {
        "id": "label_changing_validity",
        "path": "runs/final_validation_smoke_contract_full/robustness/label_changing_validity.json",
        "exists": true,
        "kind": "json",
        "size_bytes": 10863,
        "row_count": 30
      },
      {
        "id": "direct_run_log",
        "path": "runs/final_validation_smoke_contract_full/direct_baselines/baseline_runs.jsonl",
        "exists": true,
        "kind": "jsonl",
        "size_bytes": 4366,
        "row_count": 4
      },
      {
        "id": "event_run_log",
        "path": "runs/final_validation_smoke_contract_full/event_first/event_first_runs.jsonl",
        "exists": true,
        "kind": "jsonl",
        "size_bytes": 5440,
        "row_count": 6
      },
      {
        "id": "secondary_1_json_yaml_table",
        "path": "runs/final_validation_smoke_contract_full/secondary_json_yaml/json_yaml_comparison_table.csv",
        "exists": true,
        "kind": "csv",
        "size_bytes": 669,
        "row_count": 2
      },
      {
        "id": "secondary_1_model_comparison_table",
        "path": "runs/final_validation_smoke_contract_full/secondary_json_yaml/model_comparison_table.csv",
        "exists": false,
        "kind": "csv",
        "size_bytes": null,
        "row_count": null
      },
      {
        "id": "secondary_2_json_yaml_table",
        "path": "runs/final_validation_smoke_contract_full/secondary_model_compare/json_yaml_comparison_table.csv",
        "exists": false,
        "kind": "csv",
        "size_bytes": null,
        "row_count": null
      },
      {
        "id": "secondary_2_model_comparison_table",
        "path": "runs/final_validation_smoke_contract_full/secondary_model_compare/model_comparison_table.csv",
        "exists": true,
        "kind": "csv",
        "size_bytes": 673,
        "row_count": 1
      }
    ]
  },
  "systems": [
    {
      "id": "S2",
      "label": "Direct JSON",
      "color": "#07858c"
    },
    {
      "id": "E2",
      "label": "Event-first aggregate",
      "color": "#2878d8"
    },
    {
      "id": "E3",
      "label": "Constrained aggregate",
      "color": "#f26d2b"
    }
  ],
  "summary_by_system": {
    "S2": {
      "system": "S2",
      "documents_expected": "2",
      "documents_available": "2",
      "schema_valid_rate": "1.0",
      "quote_presence_rate": "1.0",
      "quote_validity_rate": "1.0",
      "temporal_accuracy": "1.0",
      "medication_name_f1": "0.0",
      "medication_full_f1": "0.0",
      "seizure_type_f1": "0.0",
      "current_seizure_frequency_accuracy": "0.0",
      "seizure_frequency_type_linkage_accuracy": "0.0",
      "eeg_accuracy": "1.0",
      "mri_accuracy": "1.0",
      "epilepsy_diagnosis_accuracy": "0.0",
      "mean_latency_ms": "0.0028954818844795227",
      "mean_input_tokens": "0.0",
      "mean_output_tokens": "0.0",
      "mean_estimated_cost_usd": "",
      "log_records_available": "2",
      "parse_success_rate": "1.0",
      "repair_attempt_rate": "0.0",
      "canonical_available_rate": "1.0"
    },
    "E2": {
      "system": "E2",
      "documents_expected": "2",
      "documents_available": "2",
      "schema_valid_rate": "1.0",
      "quote_presence_rate": "1.0",
      "quote_validity_rate": "1.0",
      "temporal_accuracy": "1.0",
      "medication_name_f1": "0.0",
      "medication_full_f1": "0.0",
      "seizure_type_f1": "0.0",
      "current_seizure_frequency_accuracy": "0.0",
      "seizure_frequency_type_linkage_accuracy": "0.0",
      "eeg_accuracy": "1.0",
      "mri_accuracy": "1.0",
      "epilepsy_diagnosis_accuracy": "0.0",
      "mean_latency_ms": "0.0",
      "mean_input_tokens": "0.0",
      "mean_output_tokens": "0.0",
      "mean_estimated_cost_usd": "",
      "condition": "primary_model",
      "family": "closed",
      "run_dir": "runs/final_validation_smoke_contract_full/event_first",
      "log_records_available": "2",
      "parse_success_rate": "1.0",
      "repair_attempt_rate": "0.0",
      "canonical_available_rate": "1.0"
    },
    "E3": {
      "system": "E3",
      "documents_expected": "2",
      "documents_available": "2",
      "schema_valid_rate": "1.0",
      "quote_presence_rate": "1.0",
      "quote_validity_rate": "1.0",
      "temporal_accuracy": "1.0",
      "medication_name_f1": "0.0",
      "medication_full_f1": "0.0",
      "seizure_type_f1": "0.0",
      "current_seizure_frequency_accuracy": "0.0",
      "seizure_frequency_type_linkage_accuracy": "0.0",
      "eeg_accuracy": "1.0",
      "mri_accuracy": "1.0",
      "epilepsy_diagnosis_accuracy": "0.0",
      "mean_latency_ms": "0.02270846744067967",
      "mean_input_tokens": "0.0",
      "mean_output_tokens": "0.0",
      "mean_estimated_cost_usd": ""
    },
    "S3": {
      "system": "S3",
      "documents_expected": "2",
      "log_records_available": "2",
      "parse_success_rate": "1.0",
      "repair_attempt_rate": "0.0",
      "canonical_available_rate": "1.0",
      "schema_valid_rate": "1.0",
      "quote_presence_rate": "1.0",
      "quote_validity_rate": "1.0",
      "temporal_accuracy": "1.0",
      "medication_name_f1": "0.0",
      "medication_full_f1": "0.0",
      "seizure_type_f1": "0.0",
      "current_seizure_frequency_accuracy": "0.0",
      "seizure_frequency_type_linkage_accuracy": "0.0",
      "eeg_accuracy": "1.0",
      "mri_accuracy": "1.0",
      "epilepsy_diagnosis_accuracy": "0.0",
      "mean_latency_ms": "0.0003119930624961853",
      "mean_input_tokens": "0.0",
      "mean_output_tokens": "0.0"
    }
  },
  "kpis": [
    {
      "id": "field_accuracy",
      "label": "Field accuracy",
      "values": {
        "S2": 0.3333333333333333,
        "E2": 0.3333333333333333,
        "E3": 0.3333333333333333
      },
      "missingness": {}
    },
    {
      "id": "temporal_correctness",
      "label": "Temporal correctness",
      "values": {
        "S2": 1.0,
        "E2": 1.0,
        "E3": 1.0
      },
      "missingness": {}
    },
    {
      "id": "evidence_validity",
      "label": "Evidence validity",
      "values": {
        "S2": 1.0,
        "E2": 1.0,
        "E3": 1.0
      },
      "missingness": {}
    },
    {
      "id": "schema_validity",
      "label": "Schema validity",
      "values": {
        "S2": 1.0,
        "E2": 1.0,
        "E3": 1.0
      },
      "missingness": {}
    },
    {
      "id": "parse_repair",
      "label": "Parse / repair",
      "values": {
        "S2": 1.0,
        "E2": 1.0,
        "E3": null
      },
      "missingness": {
        "E3": "unavailable_metric"
      }
    },
    {
      "id": "robustness_degradation",
      "label": "Robustness degradation",
      "values": {
        "S2": 0.0,
        "E2": 0.0,
        "E3": 0.0
      },
      "missingness": {}
    }
  ],
  "field_accuracy": [
    {
      "field": "medication",
      "values": {
        "S2": 0.0,
        "E2": 0.0,
        "E3": 0.0
      },
      "missingness": {}
    },
    {
      "field": "seizure type",
      "values": {
        "S2": 0.0,
        "E2": 0.0,
        "E3": 0.0
      },
      "missingness": {}
    },
    {
      "field": "seizure frequency",
      "values": {
        "S2": 0.0,
        "E2": 0.0,
        "E3": 0.0
      },
      "missingness": {}
    },
    {
      "field": "EEG",
      "values": {
        "S2": 1.0,
        "E2": 1.0,
        "E3": 1.0
      },
      "missingness": {}
    },
    {
      "field": "MRI",
      "values": {
        "S2": 1.0,
        "E2": 1.0,
        "E3": 1.0
      },
      "missingness": {}
    },
    {
      "field": "diagnosis",
      "values": {
        "S2": 0.0,
        "E2": 0.0,
        "E3": 0.0
      },
      "missingness": {}
    }
  ],
  "schema_breakdown": [
    {
      "system": "S2",
      "valid": 1.0,
      "minor": 0.0,
      "major": 0.0
    },
    {
      "system": "E2",
      "valid": 1.0,
      "minor": 0.0,
      "major": 0.0
    },
    {
      "system": "E3",
      "valid": 1.0,
      "minor": 0.0,
      "major": 0.0
    }
  ],
  "robustness": [
    {
      "perturbation": "bullets_to_prose",
      "values": {
        "E2": 0.0,
        "E3": 0.0,
        "S2": 0.0
      },
      "missingness": {}
    },
    {
      "perturbation": "family_history_trap",